[
  {
    "id": "sess-opening-plenary",
    "title": "Opening Plenary",
    "year": 2025,
    "date": "2025-06-16",
    "day": "Day 1 and 2 — UN Tech Over",
    "track": "UN Tech Over",
    "type": "plenary",
    "room": "UN Headquarters, New York",
    "summary": "The opening of UN Open Source Week 2025 framed open source as a building block for inclusive development and transparent governance. Keynote remarks by Ambassador Maurizio Massari (Italy) and Ambassador Jayantha Jayasuriya (Sri Lanka) celebrated the 70th anniversary of both countries joining the UN and the role of open knowledge platforms such as Wikipedia in countering disinformation.",
    "speakers": ["maurizio-massari", "jayantha-jayasuriya"],
    "organizations": ["italy-permanent-mission", "sri-lanka-permanent-mission", "wikimedia-foundation", "un-odet", "un-oict"],
    "projects": ["wikipedia"],
    "topics": ["open-source", "government", "community", "education"],
    "references": ["ref-global-digital-compact"],
    "provenance": { "source_url": "https://www.un.org/digital-emerging-technologies/sites/www.un.org.techenvoy/files/UN_Open_Source_Week_Conference_Report_2025.pdf", "source_title": "UN Open Source Week 2025 Conference Report (RISE 2026:04)", "license": "CC-BY-4.0", "attribution": "Sachiko Muto, RISE / OpenForum Europe", "retrieved": "2026-06-29", "method": "manual-extraction", "locator": "Day 1 and 2; Opening Plenary" }
  },
  {
    "id": "sess-hackathon-ahead-of-the-storm",
    "title": "\"Ahead of the Storm\" Hackathon — Open Geospatial Analytics for Children-Centric Climate Emergency Response",
    "year": 2025,
    "date": "2025-06-16",
    "day": "Day 1 and 2 — UN Tech Over",
    "track": "UN Tech Over",
    "type": "hackathon",
    "room": "UN Headquarters, New York",
    "summary": "81 participants in 21 teams worked over two days to co-create open source solutions protecting vulnerable children from extreme weather. Three challenges focused on child-centric weather intelligence, harmonizing multi-hazard data, and enhancing UNICEF's open-source GeoSight platform. Winning teams: Brytans, SEESALT, and T4SG.",
    "speakers": [],
    "organizations": ["unicef", "apache-software-foundation", "lpi", "cncf"],
    "projects": ["geosight"],
    "topics": ["climate", "ai", "open-source", "health", "digital-public-goods"],
    "references": ["ref-sdgs", "ref-global-digital-compact"],
    "provenance": { "source_url": "https://www.un.org/digital-emerging-technologies/sites/www.un.org.techenvoy/files/UN_Open_Source_Week_Conference_Report_2025.pdf", "source_title": "UN Open Source Week 2025 Conference Report (RISE 2026:04)", "license": "CC-BY-4.0", "attribution": "Sachiko Muto, RISE / OpenForum Europe", "retrieved": "2026-06-29", "method": "manual-extraction", "locator": "Day 1 and 2; Hackathon – Building for UNICEF" }
  },
  {
    "id": "sess-edit-a-thon",
    "title": "Edit-A-Thon — Knowledge as a Commons",
    "year": 2025,
    "date": "2025-06-16",
    "day": "Day 1 and 2 — UN Tech Over",
    "track": "UN Tech Over",
    "type": "edit-a-thon",
    "room": "UN Headquarters, New York",
    "summary": "Contributors expanded Wikipedia's coverage of global digital policy — digital public goods, AI regulation, and the Global Digital Compact. The event produced 6 new articles, edits to 234 existing ones, and more than 30,000 edits by over 37 editors, reaching nearly 2 million views within a month.",
    "speakers": [],
    "organizations": ["un-odet", "italy-permanent-mission", "sri-lanka-permanent-mission", "wikimedia-foundation"],
    "projects": ["wikipedia"],
    "topics": ["community", "education", "open-source", "digital-public-goods"],
    "references": ["ref-global-digital-compact"],
    "provenance": { "source_url": "https://www.un.org/digital-emerging-technologies/sites/www.un.org.techenvoy/files/UN_Open_Source_Week_Conference_Report_2025.pdf", "source_title": "UN Open Source Week 2025 Conference Report (RISE 2026:04)", "license": "CC-BY-4.0", "attribution": "Sachiko Muto, RISE / OpenForum Europe", "retrieved": "2026-06-29", "method": "manual-extraction", "locator": "Day 1 and 2; Edit-A-Thon – Knowledge as a Commons" }
  },
  {
    "id": "sess-maintain-a-thon",
    "title": "Maintain-A-Thon — Sustaining What We Build",
    "year": 2025,
    "date": "2025-06-16",
    "day": "Day 1 and 2 — UN Tech Over",
    "track": "UN Tech Over",
    "type": "maintain-a-thon",
    "room": "UN Headquarters, New York",
    "summary": "Structured as an unconference, over 40 participants ran 15+ breakout sessions on the full open source lifecycle — supply chain security, long-term funding, contributor recognition, and community health — reinforcing that maintenance is essential infrastructure.",
    "speakers": [],
    "organizations": ["alpha-omega", "sovereign-tech-agency"],
    "projects": [],
    "topics": ["sustainability", "security", "funding", "community", "licensing"],
    "references": [],
    "provenance": { "source_url": "https://www.un.org/digital-emerging-technologies/sites/www.un.org.techenvoy/files/UN_Open_Source_Week_Conference_Report_2025.pdf", "source_title": "UN Open Source Week 2025 Conference Report (RISE 2026:04)", "license": "CC-BY-4.0", "attribution": "Sachiko Muto, RISE / OpenForum Europe", "retrieved": "2026-06-29", "method": "manual-extraction", "locator": "Day 1 and 2; Maintain-A-Thon – Sustaining What We Build" }
  },
  {
    "id": "sess-linkedin-side-event",
    "title": "AI and the Future of Work: The ICT Sector in Transition (LinkedIn Side Event)",
    "year": 2025,
    "date": "2025-06-17",
    "day": "Day 1 and 2 — UN Tech Over",
    "track": "UN Tech Over",
    "type": "side-event",
    "summary": "More than 200 participants attended LinkedIn's side event with UN-ODET, introducing a framework — building on the UN-ODET/ILO report Mind the AI Divide — for assessing AI's impact on the workforce, with early findings on the ICT sector. Speakers emphasized that AI is reshaping rather than simply displacing jobs.",
    "speakers": ["mehdi-snene", "sarah-steinberg", "craig-ramlal", "armando-manzueta", "lucia-velasco"],
    "organizations": ["linkedin", "un-odet", "ilo"],
    "projects": [],
    "topics": ["ai", "education", "government"],
    "references": ["ref-mind-the-ai-divide"],
    "provenance": { "source_url": "https://www.un.org/digital-emerging-technologies/sites/www.un.org.techenvoy/files/UN_Open_Source_Week_Conference_Report_2025.pdf", "source_title": "UN Open Source Week 2025 Conference Report (RISE 2026:04)", "license": "CC-BY-4.0", "attribution": "Sachiko Muto, RISE / OpenForum Europe", "retrieved": "2026-06-29", "method": "manual-extraction", "locator": "Day 1 and 2; LinkedIn Side Event" }
  },
  {
    "id": "sess-d2-breakout-os-skills-ai",
    "title": "Open Source Skills in the AI Era — Perspectives from the European Open Source Academy",
    "year": 2025,
    "date": "2025-06-17",
    "day": "Day 1 and 2 — UN Tech Over",
    "track": "UN Tech Over",
    "type": "breakout",
    "summary": "Panelists examined the skills needed to sustain open source innovation in an AI-driven economy, stressing collaboration between industry, academia, and policymakers and the role of open source as a \"great democratizer.\"",
    "speakers": ["nicholas-gates", "amandine-le-pape", "david-cuartielles", "sachiko-muto", "walid-mathlouthi"],
    "organizations": ["openforum-europe", "eosa", "element", "matrix-foundation", "itu"],
    "projects": ["matrix", "arduino"],
    "topics": ["ai", "education", "community", "open-source"],
    "references": [],
    "provenance": { "source_url": "https://www.un.org/digital-emerging-technologies/sites/www.un.org.techenvoy/files/UN_Open_Source_Week_Conference_Report_2025.pdf", "source_title": "UN Open Source Week 2025 Conference Report (RISE 2026:04)", "license": "CC-BY-4.0", "attribution": "Sachiko Muto, RISE / OpenForum Europe", "retrieved": "2026-06-29", "method": "manual-extraction", "locator": "Day 2 Breakout Session 1" }
  },
  {
    "id": "sess-d2-breakout-os-ai-public-good",
    "title": "Advancing Open Source AI for the Public Good",
    "year": 2025,
    "date": "2025-06-17",
    "day": "Day 1 and 2 — UN Tech Over",
    "track": "UN Tech Over",
    "type": "breakout",
    "summary": "Stefano Maffulli introduced version 1.0 of the Open Source AI Definition (OSAID) while Amreen Taneja outlined requirements for classifying AI systems as Digital Public Goods, both emphasizing that openness must extend beyond code to training data, documentation, governance, and safety.",
    "speakers": ["stefano-maffulli", "amreen-taneja"],
    "organizations": ["osi", "dpga"],
    "projects": [],
    "topics": ["ai", "digital-public-goods", "open-standards", "licensing"],
    "references": ["ref-osaid", "ref-dpg-standard"],
    "provenance": { "source_url": "https://www.un.org/digital-emerging-technologies/sites/www.un.org.techenvoy/files/UN_Open_Source_Week_Conference_Report_2025.pdf", "source_title": "UN Open Source Week 2025 Conference Report (RISE 2026:04)", "license": "CC-BY-4.0", "attribution": "Sachiko Muto, RISE / OpenForum Europe", "retrieved": "2026-06-29", "method": "manual-extraction", "locator": "Day 2 Breakout Session 2" }
  },
  {
    "id": "sess-d3-opening-keynote",
    "title": "OSPOs for Good — Opening Keynotes",
    "year": 2025,
    "date": "2025-06-18",
    "day": "Day 3 — OSPOs for Good",
    "track": "OSPOs for Good",
    "type": "keynote",
    "room": "Trusteeship Council Chamber",
    "summary": "Amandeep Singh Gill opened the third annual OSPOs for Good track, reflecting on the adoption of the Global Digital Compact and open source's recognition as a foundation of inclusive digital transformation.",
    "speakers": ["omar-mohsine", "mithusa-kajendran", "amandeep-singh-gill"],
    "organizations": ["un-odet", "un-oict"],
    "projects": [],
    "topics": ["ospo", "open-source", "government"],
    "references": ["ref-global-digital-compact"],